text,papers
"دعوي صحة التوقيع  تعتبر دعاوى صحة التوقيع من الدعاوى ""التحفظية""، حيث إن المدعى يكون غرضه منها إثبات صحة توقيع المدعى عليه على الورقة المطلوبة . حجية الحكم بصحة التوقيع دعوى صحة التوقيع دعوى تحفظية الغرض منها إثبات أن التوقيع الموضوع على المحرر هو توقيع صحيح صادر من صاحبه، وهذا بغض النظر عن موضوع المحرر وعن نوع العلاقة الثابتة به أو صحة التصرف الثابت فيه من عدمه، فهى دعوى تحفظية، وليست دعوى موضوعية .هل دعوى صحة التوقيع لعقود البيع فقط؟دعوى صحة التوقيع تدخل فى المعاملات التجارية والسوقية والشرائية بشكل مباشر سواء عند شراء شقة أو قطعة أرض أو محل تجارى، فلابد لك من اللجوء لمحامى لرفع دعوى صحة التوقيع على عقد البيع لضمان كافة حقوقك القانونية .الشريف  للمحاماه والاستشارات القانونيةالمكتب ٣٤ شارع ام السلطان الورديان الاسكندريه0105026144401277739291فون او واتساب",سأضيف المكتب إلى قائمة اتصالاتي للاتصال به في حالة الحاجة إلى خدمات قانونية.
السلام عليكم ورحمة الله لو سمحت أفاده بالله عليك انا رحت ارخص عربيتي وطلبو كشف علي البطاقه اتفجئت اني عليا قضيه من 4 سنين سرقه وانا والله ما اعرف اي شي عنها وفي كمان موجودين في نفس القضيه 4 ودول من محافظات بعيد عني معرفش اصلا هما مين ولقيت عليا حكم ٣ شهور غيابي ومرور تحفظ عليا ورحلني علي القسم والمحامي جيه عمل معارضه وخرجت في نفس اليوم وانا ربنا يعلم اني لا أعلم من أين هذا وانا راجل موظف في البنك الأهلي وخايف على سمعتي وخايف انفصل من العمل ومش عارف مصيري اي دي بقت نقطه سوده في حياتي وانا والله العظيم عمري ما دخلت قسم نهائي افاده بالله عليكم افيدوني #تعديل أنا عرففت القاضيه إللي عليا لكن والله ما  أعرف شيء عنها طلع موبايل مسروق وأنا إسمي جيه عن طريق شركة اتصالات أضافوا إسمي لأن كان في خط  بتاعي من 2016 ولما وقع مني مفكرتش اطلع شريحه سعتها وطنشت واكتشفت اني القضيه معموله للخط دا وكذا شخص كمان وأنا معرفش حاجه عن الخط  من زمان وحضرت جلستين واتأجلو لحين حضور مفرات القضيه فبالله عليكم افيدوني أنا مصيري أي في حاجه ما ليش يد فيها أنا معترف إني مستهتر  لما طنشت الخط الزمان افيدوني,يمكن على المحامي أن يدرس حالتك ويقدم توصيات لك حول ما هي الخطوات التالية التي يجب اتخاذها في القضية.
عندي استفسار وياريت تردوا عليا ضروري فيه واحد شغال عندي ف المحل بتاعي جاب قرض من ورايا ع المحل بتاعي من غير م اعرف وعمل عقد إيجار من نفسه اني مأجرله المحل وبطاقه ضريبيه وسجل ب اسمه كده يبقي فيه ضرر عليا او ع المحل انا مامضتش ع ورق ولا كنت اعرف حاجه ولا عندي لسه بطاقه وسجل وامن نفسي ازاى للعلم ان المحل ف بيتي,"بشكل عام، قد يكون هناك خطورة على المحل وعليك التأكد من أنه تم إجراء كل الإجراءات اللازمة لحمايتك وحماية ممتلكاتك."
سلام عليكم ورحمه الله وبركاتهممكن سؤال فحالة طلاق واحد سيدة دفعات للطلاق والزوج ديالها مكيبغيش يتسلم الاستدعاء,"ولكن في النهاية، سيتم تسليم الأوراق اللازمة للمحكمة ويمكن للمحامي تمثيل السيدة وتشكيل دفاع قوي لها في حال تقديم الزوج لأوراق الطلاق والمحاكمة."
الجاني ممكن يرتكب جريمة القتل بسبب غضب شديد أو انفعال سببه إستفزاز المجني عليه. الاستفزاز الصادر من المجني عليه مش سبب للبراءة -مهما كانت درجة الاستفزاز- لأن الغضب الشديد مش بينفي القصد الجنائي سواء العام أو الخاص.مينفعش متهم في جريمة قتل يدفع بإنعدام القصد الجنائي الخاص «نية إزهاق الروح» لأنه كان في حالة غضب طب ايه فايدة الدفع بوجود إستفزاز من المجني عليه؟   ثبوت إستفزاز المجني عليه للجاني مهم جدا في اثبات «انتفاء الإصرار والترصد» في جرائم القتل. اختصارا وجود حالة من حالات الاستفزاز يعتبر عذر مخفف للعقوبة لكن لا يترتب عليه البراءة. # مؤسسة عزب للمحاماة والأستشارات القانونية,"لذلك، يجب علينا كمحاميين جمع جميع الأدلة والشهود اللازمة لإثبات وجود الاستفزاز للجاني، كما يجب علينا البحث عن أدلة تثبت عدم وجود الترصد والإصرار في قتل المجني عليه."
السلام عليكم ورحمه الله وبركاته بعد اذن حضراتكم زوجتي رافعه القايمه اسره والقايمه بمليون جنيه نصفهم عفش ونصف دهب والدهب مكتوب في القايمه ٦٠٠جرام المأذون مسعر الدهب علي حوالي ٨٠٠جنيه مع العلم فتره الزواج مكملتش شهر ايه الحل القانوني وشكرا,يمكنك الذهاب لمحامي للاطلاع على الإجراءات القانونية اللازمة لتقديم الدعوى باحتساب كل ما يحق لك ولزوجتك وطرح كل الأدلة والشهادات التي تثبت عدم صحة القايمة.
السلام عليكم....ارجو من حضراتكم الإفادة ليا في أسرع وقت : انا متجوزة وفي مشاكل كتير بيني وبين جوزي وبيهددني ياخد ابني مني لحد اللحظة دي وانا خايفة انام لياخده من جنبي وظروفي المادية ما تسمحش اني اجيب محامي ف ممكن محكمة الأسرة لو روحتها الصبح تفيدني ولا لأ ؟؟؟ ولا أروح اعمله محضر  ولا اعمل ايه ؟؟؟ انا خايفة جدا جدا والله اعتبروني أختكم,"إذا كانت لديك أدلة وانطباع قوي بأن طفلك في خطر، يجب عليك اتخاذ الإجراءات القانونية المناسبة."
صباح الخير عندي استشاره منفضكم ابني محبرس والقض بتاعو يوم 8اتناشر والمحامي اتصل وقلي النيابه وفت علي النقض هيا دي حاجه كويسه ولا ايه,يمكن للمحامي الخاص بك أن يحضر إلى الجلسة ويبدي رأيه حول هذا الموضوع ويساعدك في تحضير الأوراق اللازمة لأي قرارات قد تصدر من المحكمة.
هل يحدد القانون مدة معينة للمتهم لإمكانية عمل الاستئناف بعد الحكم في المعارضة ... ام انها وقت مفتوح,"على سبيل المثال، في مصر يحدد القانون مدة ثلاثين يومًا لتقديم طلب الاستئناف بعد صدور الحكم في المعارضة."
سلام عليكم لو في 3 اطرف في قضيه الاول وتاني اخده فيه براء والتالت اخد حكم نهائي جنائي هل بيكون في حل ولو عمل نقض هل هيتم الموافقه علي النقض شكلا وموضوعا,"وإذا قدم أحد الأطراف ""براءة"" فإنه يجب دراسة صحة البراءة وشكلها (هل هي براءة صادرة عن محكمة أم مجرد أقوال من الطرف نفسه)."
السلام عليكم لو سمحتم عايزه استشير حضراتكم ⁦⁩دلوقتي انا لقيت واحده بتعمل حجات حرام و عرفت انها مرضه نفسيا فتواصلت مع اختها و قولتلها كل شئ و قولت بالشات انها كأنها فتاه ليل فلما اختها واجهتها هي سلطت عليه واحد يرن من ارقام غريبه فهددتها اني افضحها قصاد اسرتها فسكتت ⁦⁩انا كنت بحذف الرسايل ديه اول بأول بس ممكن يكونوا احتفظوا بنسخه اضافيه من كلامي بالشات في صوره   اسكرين شوت و حفظولي الصوتيات اللي بعتها بصوتي خاصه انه  ممكن يحذفوا رساله من اللي قولته بظون ما اعرف لان التليجرام بيتيح دهفممكن يبان اني بشتم و بهدد بدون سبب اساساو ممكن يكونوا سعوا بموضوع ااقضيه ده من فتره حديثي علي التليجرام و الواتس معاهم الله اعلم  سؤالي هو ممكن يقدموا فيه بلاغ تهديد او سب و قذف و ما الي ذلك ؟,"ولذلك، قبل أن تقومي بأي إجراء آخر، فإنه من المستحسن استشارة محامٍ محلي للحصول على نصيحة قانونية حول الموقف الذي تواجهينه."
الموضوع باختصار عقارين مدخل السلم مشترك مابينهم طوله 5 أمتار في 2.5 عرض  .. أحد العقارين عائلي والتاني صاحبه طلع منه واستثمره سكني لمعارفه بنيه تطفيش صاحب العقار الثاني العائلي وبوابه المدخل ال24 ساعه مفتوحه بسبب السكان  وده مسبب ضرر للعقار العائلي ده غير وسائل التطفيش الأخري  اللي بيستخدموها  من قمامه او قطع اسلكه الكهرباء وقبل كده تم التعدي علينا باسلحه بيضاء وعملنا محضر ولم يتم اخد اجراء وتم حفظه بالنيابه  ... وجبنا كبار العائله لفصل السلم ولكن بقي الوضع كما هو عليه السؤال .. هل في اجراء قانوني يقدر يحل المشكله دي بحيث يكون الفيصل لقسمه مدخل السلم,يجب الحصول على تقرير من خبير عقاري يثبت وجود الأضرار التي تعرض لها العقار العائلي بسبب استخدام العقار الآخر للمدخل المشترك بشكل خاطئ.
لو سمحتم قريبي كان ماشي هو اخوه فظابط أو لجنه وقفتهم فالمهم اخوه كان عليه قضية فاخدوه هو وأخوه وفي البندر معرفش اي اللي تم غير انهم اتعملهم قضية تعاطي والغريبة أن قريبي دة مش بيتعاطي المهم خرجوا بكفالة ودفعوها . قريبي يتفاجأ أن طالبينه وإن القضية اتحكم فيها غيابي طيب مش المفروض يدخل يعمل معارضة ويطلع لا طبعا دة حبسينه لغاية ميعاد الجلسة طيب الجلسة امتي لسه متحددتش . طيب مخدوش اخوه معاه ليه يقولوا اصل ده دخل لوكيل نيابة ودة دخل لوكيل نيابة . طيب اخوه الجلسة بتاعته يوم 23 واكيد هو بعده . طيب اشمعنا قريبي جوه الحبس وأخوه بره يقولوا اصل قريبي اتحكمت عليه غيابي وهو مرحش . هل الكلام دة ممكن يكون صحيح . ارجو الافادة,"ولكن، يمكن لمحاميك القيام باتصال بالنيابة العامة أو المحكمة المعنية لمعرفة التفاصيل والمساعدة في إيجاد الإجراءات اللازمة للدفاع عن قريبك."
لوسمحتم  معروض عليه شقه للبيع   ٢٥٠ الف صاحبتها  عايزها كاش وانا  اقترحت عليها ادفع ٥٠ الف والباقي بعد شهرين ونص   عشان انا عامله  شهادة وتنتهي بعد شهرين ونص صاحبتها  قلقانه للي انا قعد في شقه  وماادهاش باقي المبلغ انا قولتها ممكن نضيف بند  انا مااستلمش الشقه اللي بعد سداد   باقي المبلغ المده المحدده هل البند ده  لواضف في العقد ابتدائي  في ضرر عليه جازاكم الله خيرا,"عزيزي الموكل، إضافة هذا البند في العقد قد يؤثر على حقوق الطرفين في المستقبل ويمكن أن يكون له تبعات قانونية."
لو سمحتلو حد حصلو عاهة مستديمة بنسبة 25٪مع سبق الإصرار والترصدممكن اعرف اللي عمل فيه كدا ياخد حكم قد ايهوقضية التعويض تكون ف حدود كام,"هذا النوع من القضايا يتطلب الإجراءات القانونية والوثائق اللازمة الخاصة بها، ولذلك يجب التحدث مع محام يتخصص في هذا المجال ليتمكن من تقديم النصح اللازم ورفع الدعوى أمام المحكمة."
انا عملت تحري عن المدعي عليه في دعوى نفقة لمعرفة مفردات المرتب عن طريق الشغل بتاعوا وطلعت 9000 جنية وطلعت كمان انو كان اجازة بدون مرتب بسبب انه مسافر مرافق لزوجته التي تعمل في دولة ...... ودة اتكتب في المفردات اللي انا استلمتها من جهة عمله وتحري القسم قال انه يعمل في هذه الدولة هل كدة في مشكلة او تناقض وهل القاضي ممكن يحكملنا بنفقة كويسةولا ممكن يعتبروا انو مش بيشتغل ولا ممكن يحولها للتحقيق,"بالإضافة إلى ذلك، يجب إثبات احتياج الأطفال إلى النفقة من خلال تقديم الوثائق المتعلقة بالنفقات الأساسية لهم، مثل السكن والتعليم والرعاية الصحية."
لو سمحت عايز اعرف لو صاحب البيت عملى قضيه طرد ولا لاء,"حسب القوانين المصرية، يجب على صاحب البيت تقديم طلب لإخلاء المستأجر قبل رفع دعوى طرد."
كنت بشتري شقة في الدور التاسع في عمارة مخالفةوهي داخلها عداد كهربا وصاحبها مقدم في التصالح ودافع مرحله أولى وعرض الشارع ٨ مترفهل في حاجه تخوف في الموضوع ده؟,"يجب عليك التأكد من صحة العمارة وتصريحات البناء الصادرة من الجهات المختصة قبل شراء الشقة، إذا كانت العمارة فعلاً مخالفة فقد تواجه مشاكل حقوقية في المستقبل بسبب ذلك."
السلام عليكممن فضلكم ممكن الإفادة الزوج مسافر خارج البلاد والزوجة تركت البيت هل متاح من ينوب عنه بعمل طلب انذار  بالطاعة ؟وهل متاح من ينوب عنه بتحرير محضر بواقعه  خروجها من المنزل وأنها اخذت الذهب ومبلغ مالي وتفاصيل  الواقعه ؟ المحضر بغرض المدافعه علي نفسه عند رفع اي قضايا عليه واثبات حالة بأنها خرجت بالذهب  •هل تأخير تحرير المحضر يأثر سلبا علي ضمان حق الزوج ؟وعند تحرير المحضر من الافضل اتوجه لقسم الشرطة ام اتوجه لمكتب محاماه لعمل مذكرة ؟,"وعليكم السلام ورحمة الله وبركاته، بشكل عام، فإنه يمكن لأي شخص يتمتع بالصلاحية المناسبة بأن ينوب عن الزوج في تقديم طلب إنذار بالطاعة وإخطارها بالواقعة."
السلام عليكمشقة والدي تم قسمتها بيني و بين اخويا لشقتين و في عقد قسمة بذلك انا دلوقتي عايز اعرف وضع الشفتين ايه بالنسبة للقانون و الحكومة و عايز اقننها علشان ادخل مرافق ليها ايه الاجراءات,"وسيقوم حسابك العقاري بإصدار رخصة البناء الخاصة بالشقتين وسيكون بإمكانك بعد ذلك إجراء التعديلات اللازمة على الأوراق اللازمة للحصول على المرافق والخدمات العامة، مثل الكهرباء والمياه والغاز."
صوره من حكم استئناف اتوقف وقف حزئي وعدت المده واتعمله تعجيل من الزوجه   علشان ياخد باعتبار الاستئناف كأن لم يكن ده بيكلف كام رسوم,ثم يمكنك مساعدته في إجراءات رفع القضية إذا كان ذلك مستحيلا.
في محضر كان معمول فيا من شهر واللي عامل المحضر قال هيخلي المحامي بتاعه اللي عمل المحضر يتنازل اعرف ازاي رقم المحضر وأتاكد  ازاي أن اللي عامل المحضر أتنازل,عادةً ما يتم تسجيل تنازل الشاكي في المحضر الأصلي ويمكنك الحصول عليه بطلب نسخة من المحضر من المكتب الذي تم فيه عمل المحضر.
لو سمحت ياجماعه أنا شغال أمن في كمبوند وفي ساكن كان جايله شحنه عن طريق امازون فالمندوب سالمهالي علي البوابه والساكن بعت إخوة خدها بالليل . بس بعديها ب ٥ ايام بيقول أنا مستلمتش حاجه وأخوه بينكر أنه خد اي حاجه مني  المشكله ان مفيش كاميرات علي البوابه ايه الحل مع الشخص ده لانه بيقول الشحنه دي كانت اي فون . ارجو الرد .,"رابعاً، إذا لم يتم التوصل إلى حل يُعَدُّ مقبولاً، يمكنك الاتصال بمحامٍ أو مستشار قانوني للنظر في الجوانب القانونية للقضية والمساعدة في الحصول على حقوقك بشأن الشحنة المفقودة."
قعدت تمن سنين مع محامي على أنه يجيبلي حقي من اخواتي حقي اربع قراريط وهما مرضيوش يدفعوا ولا حتى استلمها وبنوا على الفدان المشاع اللي انا ليا فيه قيراطيين الخبير نزل من سنة ونص وقلنا خلاص المحكمة هتحكم وكل شوية تتاجل لحد مابقت تمن سنين ودلوقتي للاسف مبقتش واثقة في حد خالص ليه كدا بتقعد كل السنين دي كلها حتى عاوزة اعمل قضية تانية بعيدا عن الأرض وبقيت مترددة اعمل ايه بس هل بعد مالخبير مابنينزل بتقعد كل دا لسه عاوزة اعمل صحة ونفاذ عنده ولكن بقيت مترددة بقيت خايفة حتى كل ماقله اعملي ريع على اربع قراريط خلال تمن سنين يقولي لما الاولى تخلص وللاسف مبنخلصيش مبنخلصيش اعمل ايه دلوني وحاولوا تفصلوا في ردودكم في كونكم محامين من عدمه لاني لست خبيرة وقدامكم واحدة في حيرة نفسي اعمل صحة ونفاذ ولكن القضية الأولى بتاعت الأرض خلتني مترددة,"ثانيًا، يجب متابعة القضية الأولى المتعلقة بحقوق الأرض والدفاع عنها، ومحاولة إنهاءها بأقرب وقت ممكن عن طريق الاتفاق مع الأطراف الأخرى أو عن طريق الحصول على قرار قضائي."
الجلسة التانية في قضية النفقة ينفع اخد شاهد معايا ولا لازم القاضي هو اللي يطلب؟,"من النادر أن يُسمح للمدعي بإحضار شهادة شاهد في الجلسات الثانية في قضية النفقة، لذلك يجب التأكد من متطلبات القانون في بلدك ومن القوانين التي تُنظم هذا الأمر."
السلام عليكم ورحمه اللهعاوز اسال سوال قانوني شويه لو في حد عنده مبلغ في البنك و عاوز يكتب جزء منه لشخص شرعا لا يرث منه يعمل ايه عشان انا عارف ان البنوك بتاخد باعلام الوراثه في المحكمه فهنا ايه الحل,وينص القانون المدني في كثير من الحالات على أهمية توثيق الاتفاقيات الشخصية والتوصية بهذه الخطوة عندما يتعلق الأمر بمشاريع مشتركة أو نقل الملكية أو تحويل الأموال.
طيب انا معايا شيك بدون رصيد على شركة شغاله بملايين بيقولى أصبر شوية بس لكن انا محتاج الفلوس ضرورىهو  ممكن حد يشتريه,"بدلاً من ذلك، يمكنك التحدث مع المدير المسؤول في الشركة ومحاولة التوصل إلى حلول تتناسب مع احتياجاتك، مثل تسديد الشيك أو الاتفاق على خطة لتسديد المبلغ المستحق بالتدريج."
توعية قانونية وردا علي إحدي الرسائل / أى مالك عنده عمارة او برج مثلا و بيبيع ف الشقق تمليك عليه عند تحرير عقد بيع لاى شارى لاى شقة ان يحرص على تحرير بند يفيد بتنازل حق الشارى ف الشفعة لانه باتمام البيع يصبح الشارى شريكا ع المشاع مع صاحب العمارة و مع من اشترى حيث انه م الطبيعى انه يحرر له امتار ف الارض مشاعا بنسبة وحدته المشتراه و عليه يكون له حق التشفع مما يؤدى الى احتمالية عرقلة البيع لباقى الاعين,"وفي النهاية، فإن تحرير بند صريح وواضح حول التنازل عن حق التشفع في العقد هو مفتاح للتأكد من عدم تعرض البيع للعرقلة لاحقًا."
لو انا واخده حكم علي حد وبيهددني علشان أتنازل او عايز يعمل مشكلة ويتخانق معايا اتصرف ازاي قانوني,"أما إذا كنت تريد التراجع عن حكم صادر ضد شخص، فيجب عليك مراجعة محاميك لمعرفة الإجراءات القانونية اللازمة لذلك، وتقديم الوثائق اللازمة إلى المحكمة."
بخصوص الإيجار الحديث ازاي اضمن ان المستأجر هيدفع اخر شهر له في المايه و الكهربا والغاز؟ هل يوجد أي ضمانات لذالك؟,"التحقق من هوية المستأجر: يجب عليك التحقق من هوية المستأجر ونوع العمل الذي يمارسه ومصدر دخله، وهذا سيساعدك في تحديد مدى احتمالية دفعه للإيجار والمصاريف الأخرى."
"السلام عليكم , كنت بتعامل مع حد بيعملي شغل طباعة وكان واخد نص الفلوس وللاسف مخلصش الشغل بقاله 5 شهور وكل شوية يتاخر ويماطل  ويتحجج فقولته خلاص ابعتلي فلوسي مش بيرد وفيه شات بينا بيثبت الكلام ده , هل ممكن اخد اجراء قانوني ضدة وارجع فلوسي","إذا لم يرد الشخص عليك، يمكنك مراجعة محامٍ لتقديم دعوى قضائية ضد الشخص الذي تعاملت معه من أجل استرداد أموالك."
