text,papers
السلام عليكم عندنا مستأجر مركب 3كاميرات 2 فى مدخل البيت و واحدة على باب شقته و الكاميرات الموجودة بالمدخل مخترقة خصوصيتنا طلبنا منه اكتر من مرة يشيل الكاميرات اللى بالمدخل و رفض هل من حقه يركب كاميرات بالمدخل مع العلم لم يستأذن السكان قبل تركيبها,وهذا يشمل: 1- الشهادات العائلية لجميع السكان المعنيين 2- عقد الإيجار الخاص بالوحدة السكنية 3 - أي صور للكاميرات في الأماكن التي يمكن أن تؤدي إلى خرق الأمانة.
السلام عليكم انا واخده شقة ايجار بس كاتبين عقد ابتدائي غير موثق في الشهر العقاري ومفروض أنه 5 سنين وفي زيادة عشر في الميه كل سنه والمفروض باقيلي سنه وعقدي يخلص بس المالك عاوز زيادة 700 جنيه وبيقولي لو مدفعتيش همشيكي  عاوزه افهم هو ينفع فعلا يعمل كده وكمان كاتب بند في العقد أنه لو عاوز يمشيني يعرفني قبلها ب 3 شهور ويمشيني أنا محتاجه افهم,"وعليكم السلام، يجب عليك مراجعة العقد الابتدائي الذي تم توقيعه لتحديد مدة العقد والزيادة السنوية المذكورة فيه."
استأذنكم .. دلوقت أنا ببيع سيارتى بعقد مسجل بالشهر العقارى..لكن المشترى مش عايز يمضى على العقد غير وقت نقل ملكية السيارة.. هل دا طبيعى؟وهل أنا كدا خرجت نفسى من مسؤلية تبديد اللوحات؟,يجب عليك التأكد من عقد البيع المسجل بالشهر العقاري لتحديد أي التزامات قانونية قد تكون عليك عندما تتم عملية نقل الملكية.
عندي بارتشين فى نادي وللاسف حصل مشاكل فى النادي ادة ان الانشطه صارت معدومه ومعتش فيه حد بيخش النادي وبقا المكان شبه مهجور مقتصر على نشاطات بسيطه كنت مأجر بعقد 3 سنبن . ودافع تأمين شهرين وانا الى عامل البارتشن على حسابي ومن ضمن شروط العقد ان البارتشين هيكون ملكية المكان طبعا مع ظروف النادي والوضع الحالي اتراكم عليا ايجار 3 شههور. ف انا عايز اسيب المكان ب اقل خساير اي الوضع قانونا هل فى مخرج. او اى حاجه اقدر استفادها لو قومت محامي,"إذا كانت الشروط تسمح بإلغاء العقد واسترداد جزء من الأموال المدفوعة، فيمكنك اتباع الإجراءات المنصوص عليها في العقد."
توفت امى ولها ميراث عند ابوها المتوفى وسيتم التنازل عنه لصالح خالى هل هذا العقد يخضع لضريبه التصرفات العقاريه وهل يوجد صيغه معينه لتجنب الضريبه,"لذلك، ينبغي الاستشارة بمحامي متخصص في القوانين العقارية بالدولة المعنية لمعرفة الصيغة القانونية المناسبة والوثائق المطلوبة لتجنب الضريبة."
سلام عليكم ورحمة الله وبركاته لو انا ماضى على ايصال امانه ب 9الاف جنيه وانا مش معايه الفلوس دلوقى وصاحب الايصال رافع عليا الوصل ايه العقوبه الى هخدها,إذا لم تستطعي دفع المبلغ المتبقي على الايصال فإن صاحب الايصال له الحق في رفع دعوى قضائية ضدك لاسترداد المبلغ المتبقي.
محتاج اعمل سجل تجاريمن غير ماخش فى سكة بطاقه ضريبية مع العلم انه محل سوبر ماركت,"بعد تقديم الطلب والمستندات المطلوبة، ستحتاج إلى دفع الرسوم المقررة لإصدار السجل التجاري ونشره في الجرائد الرسمية."
جماعه عاوز محامي اتكلم معاه بأستفاضه اكون شاكر ليه جدا ضروري بخصوص حاجه تابع النفقه و شكرا ,يرجى إعلامي بموعد مقابلتكم المفضل حتى يتم الإعداد لها.
هل من الممكن تقسيم الورث في عدم وجود احد الورثه؟,"نعم، يمكن تقسيم ميراث المتوفى في حالة عدم وجود أحد الورثة بما يسمى ""اختفاء وريث""، وفقًا للأنظمة القانونية في بعض الدول."
:السلام عليكم عندى شقة فى الشروق و معايا الورق التالي و كل  الناس مصصمة لازم توكيل بيع للنفس و العير مع العلم ان معايا عقد بيع عليه صحة توقيع و حكم محكمةمخالصة بثمن الشقةتوكيل حق تنازل للنفس عن عداد الكهرباءتوكيل بيع للنفس فقط,"وأخيراً، يجب عليك التأكد من صحة جميع الأوراق المطلوبة قبل تقديمها إلى المحكمة، وتأكد من عدم وجود أية مطالبات قانونية لأي من المالكين الأصليين للشقة."
سلام عليكم علية حكم غيابى سنة جنحة ضرب ومعاية مايسبت انى فى شغلى متوقع براء ولا استناف وشكرا,وينبغي للمحامي الاطلاع على جميع الوثائق والشهادات المتعلقة بالقضية للتأكد من وجود جدية في الرفع من الحكم الغيابي وتفضيل الاستئناف عن براءة المتهم.
من فضلكم لو انا مسافر خارج مصر وعايز اشتري شقه ينفع تتكتب بأسمي وانا مسافر,"نعم، يمكنك شراء شقة في مصر وتكتب باسمك حتى وإن كنت خارج مصر، ولكن يجب عليك اتخاذ بعض الإجراءات: 1- الحصول على رقم تعريف ضريبي في مصر."
اشتريت ارض وبنيت عليها وسكنت ومستقر ليا عشر سنواتاللي اشتريت منه الارض اخواته رفعو عليه قضيه ريع وبعدين فرز وتجنيب وبعتو اعلان لكل اشترى وبنا وانا واحد من ضمن ١٧ واحد باني ومستقرايه العمل وهل فيه ضرر علينا ولازم نحضر ولا مش لازم ارجو الافاده مع وافر شكري وتقديري,"من الأفضل أن تتواصل مع محامي لتقديم النصح القانوني اللازم في هذه الحالة، إلا أنه عادة ما يتم إرسال إشعار بالمحضر إلى جميع الأطراف المستفيدة من الأرض في المحكمة."
عايزه محامى او محاميه يكونو مش همهم بس الفلوس ولا بيبيعو الشخص للخصم قضايا اسره,"لذلك، يمكنك البحث عن محامي مختص في قضايا الأسرة عن طريق الأصدقاء الموثوق بهم، عبر الإنترنت أوعن طريق مكاتب الحقوق المدنية."
يوجد عقد ايجار قديم لشقه ملك والدي لسيده وتوفي والدي وتوفيت السيده منذ 5سنوات ولها اولاد متزوجون ولكن لها بنت لم تتزوج وهي في الشقه الان ولكنها علي فراش الموت والله اعلم واخاف بعد موتها أن يسكن في الشقه أحد من اخواتها المتزوجون فهل هناك تصرف قانوني الان لضمان حقي,ينبغي التنسيق مع قوات الأمن أو الشرطة المحلية لمساعدتهم في مراقبة و تأمين الشقة أثناء استكمال إجراءات القضية.
قضية ضرب افضى لموت ليه محامى المتوفى طالب من اهله اعلام وراثه؟؟,"إذا تم تحديد أن سبب الوفاة هو الضرب، فيمكن لأهل المتوفى التقدم بدعوى قضائية ضد الجاني بتهمة القتل وفقًا للقانون المعمول به في المنطقة التي وقعت فيها الجريمة."
انتبه - لو عندك مشكله ميراث مافيش غير الثلاث دعاوى الى شرحتها وطبعا تختار واحده بس منها تناسب حالتك مش المحامى يجرب فيك لان مازال بشوف الفتاوى برفع جنحه الامتناع عن تسليم ميراث رغم ان الحصه المطلوبه مشاع لكن المحامى بيفرح الموكل بيها ويقوله دى دعوى سريعه وهحبسهولك ولما يتحكم بالبراءه يقوله اصل القاضى مش فاهم ويرفع له فرز وتجنيب ويقوله الخبير هينزل يقسم وتاخد ميراثك وطبعا مش بتقبل القسمه ولما يتحكم بالمطالبه ويتخرب بيت الموكل بيستعوض ربنا فى الميراث رغم ان الحل كان ادامه الحل لو حصتك مشاع ومش هتقدرى على مصاريف الفرز وتجنيب والمطالبه الى بتخرب البيوت ترفعى دعوى مقابل انتفاع عن حصتك من تاريخ وفاه المورث وحتى استلامها تسليم فعلى- ياريت تشيروا لان حقوق ورثه كتير بتضيع بالطريقه دى,"والدعوى التي تقترحها تعتبر ذات أهمية كبيرة بالنسبة للمستحقين للميراث، وتحتاج إلى خبرة ومهارة المحامي لتوصيل حقوق الورثة الصحيحة والمشروعة بشكل أفضل."
سلام عليكم ارجو المساعده هل ينفع اروح المحكمه اعمل شهايد مخالصه بنفسي لأن المحامين طالبين مبالغ كبيره وانا حكايتي ع الله ارجو المساعده لو سمحتم,يمكنك التواصل مع الجمعيات الخيرية التي توفر خدمات المساعدة القانونية للمواطنين الذين لا يمتلكون القدرة المادية لتسديد أتعاب المحامين.
لو سمحتوا كنت عندى استشارة اخويا رافع قضية على اخوبا التانى استحواذ على ورث وطلع عليه غرامة 20000 وبيقول انه حياخدصورة الحكم ويرفع قضية حق مدنى كنت عايزة اعرف قضية الحق المدنى اا بتترفع بصورة الحكم بتاخدوقت اد ايه وفيها نقض ولا ايه وهل هو حيطلب تعويض ولو اخويا معهوش يدفع التعويض ايه اللى حيتم,للأسف لا يمكنني الإجابة على هذه الأسئلة لأنها تتطلب معلومات أكثر تفصيلاً حول الحالة والقانون المعمول به في البلد الخاص بك.
السلام عليكم ممكن استشاره دلوقت اناجوزي ٥سنين مبيشتغلش وانا كنت شغاله وبصرف والآخر زهقت وأطلقت عشان مبقتش قادره علي مصاريفه دلوقت انا مع الغلا مبقاش في بيع لان شغاله اونلاين وعايزه ارفع نفقه ودلوقتي الاب فاشل وعاطل اصلا بس الجد بياخدمعاش ٤الاف فهل ممكن اطالب الجد بالنفقه لان الاب معسر لان الاب عاطل مش بتاع شغل ولا ايه الحل اناعندي ٣اطفال لسه اكبرواحد ٦سنين,"بشكل عام ، توجد إجراءات قانونية يمكن اتخاذها لمطالبة الأب بالنفقة إذا لم يكن قادرًا على دفعها بصورة طبيعية."
السلام عليكم اشترينا شقه مازال عليها اقساط للمجلس اتفقنا مع صاحبها علي مهله شهر من تاريخ كتابه العقد وده موثق بالعقد كتبنا عقد خالص التمن وحاليا ف المحكمه بياخد صحة توقيع ماضي وباصم عليه ودفعنا نص المبلغ والنص التاني بوصل امانه علي معاد الخروج نستلم الوصل والشقه وهو ياخد باقي فلوسه لم يتم التنازل عن العدادات ف الشهر العقاري وكتبنا شرط جزائي ب٥٠الف حاليا هو بيقول مش لاقي شقه مناسبه وممكن نرجع ف البيع وملكوش غير الفلوس اللي دفعتوها ومفيش شرط جزائي ايه الإجراء القانوني معاه اللي يكون سريع ويضمن حقي,"أولاً، يجب على محاميك الرجوع إلى عقد البيع والشراء والتأكد من أن جميع شروط العقد تم تنفيذها بشكل صحيح من قبل الطرف الآخر."
لو واحدة فاتحة حضانة من غير ترخيص وجه بتاع الضرايب والتأ مينات بس هي قالتله لا انا بدي دروس وهو معندوش اي اثبات انها فاتحة حضانة مش معلقة يافطة ولا اي حاجة فكده ممكن يضرها ولا ايه الاجراءات اللي ممكن تعملها ؟,"في هذه الحالة، يمكن لصاحبة الحضانة القيام بالإجراءات القانونية اللازمة للحفاظ على حقوقها وحماية نشاطها."
"أختي رفعت استئناف في حكم اعتراض على إنذار طاعة ،،أي اللي ممكن يساعدنا قدام القاضي مع العلم انها قعدت شهرين بس،،وضربها لوحدها واحنا شوفنا العلامات في جسمها ولكن محضرناش الواقعة ،،وانه بيكسر في عفشها ،،وكان دائم التهديد لها بالطلاق ،،وانه ياخدها مكان محدش يعرفه ،،بدون عفش،،وعفوا عنده مرض العنه والشذ*ذ. عافانا الله وإياكم ،،ولكن اكتشفنا أن المحامي على تواصل بالخصم ،،ودا اللي خلانا وصلنا للاستئناف،،أرجو الإفادة أثابكم الله","- يمكن للمحامي الطلب من شقيقتك جمع الدلائل الأخرى التي قد تساعد في دعم حالتها، مثل الرسائل النصية أو البريد الإلكتروني."
"كنت رافع ايصال امانة جنحة ،،المتهم اخد ست شهور ،،لكن بالاستئناف اخد براءة بناء على تحريات انى كنت على خلاف مادى  مع اخوه الهارب وان المتهم وقع لجبر الضرر،،رفعت امر الزام بالمبلغ ،،اتحددت جلسة واتأجلت ،،وبعد التأجيل القاضى اجل للحكم ،،فهل الحكم يكون لصالحى بأذن الله  ام لا","ومن المهم أن تعمل على جمع الأدلة ووضع حجج قوية لدعم حقك في القضية، والاستعانة بمحام متخصص لتقديم أفضل حلول قانونية وفي مصلحتك."
السلام عليكم ورحمه الله وبركاتهاستفسار بعد اذن السادة المستشارين شخص. قدم في ايصال أمانة عملت استنىاف ومقدرتش احضر كنت محجوز في المستشفى فأنا قدامي معارضة استنئافية هل القاضي ممكن ياجلي لو حضرت انا والمحامي بتاعي للاطلاع وحضرت بشخصي ولا لا,ولكن عادة ما تقدم الأسباب التي تمنع حضورك في طلب تأجيل وعلى القاضي قرار تأجيل الجلسة أو عدم تأجيلها وفقًا للقوانين المحلية المعمول بها.
استفسار بخصوص قطعة أرض بعد حكم المحكمه وصحة التوقيع ما هي الخطوة التالية وما مدة استخراج العقد,"كما يجب التأكد من دفع جميع الرسوم المطلوبة والمصروفات المتعلقة بالعقد، وأن يتم استكمال جميع الإجراءات اللازمة لضمان سلامة الملكية وحقوق المالك."
السلام عليكم … عندي شقة اشتريتها من المقاول في الدور الارضي  … المفروض كان في اتفاق بين المقاول وصاحب الارض ان الدور الارضي الي شقتي فيه تبقي مناصفه بين المقاول وصاحب الارض بحيث لما المقاول يشطب الشقه ياخد توكيل ببيع الشقه … بعد لما المقاول باعلي وعملت صحة توكيل واستلمت الشقه وحطيت عفشي … لقيت صاحب الارض بيقولي المقاول ملوش حق يبيع ومش معاه توكيل وانا هاخد شقتي … المقاول رفع غليه قضيه عشان يديله التوكيل والقضيه لسه شغاله … دلوقتي صاحب الارض بيقولي روح اعمل محضر اثبات حالة ان انت مقيم في الشقه وانا هديك التوكيل مش عارف اعمل كده ولا هو كده بيحاول يلبس المقاول انه باع حاجة مش من حقه يبيعها ويبقي البيع بتاعي باطل … اسف للاطاله وبرجاء المساعده,"عليك الاتصال بمحامي مختص في قضايا عقود العقارات ليساعدك في هذه الحالة، فهو المختص في التعامل مع مثل هذه الأمور."
السلام عليكم عندي استفسار  لو سمحتم هو لو حد خد نسخه من اصل توكيل شقه  عشان الشراء ومش تم البيع ممكن يعمل اي لعب في الشهر العقاري بالتوكيلات دي من غيري,"وبالتالي، لا يمكنه القيام بأي لعب في الشهر العقاري بتوكيلات وهويات لم توثّق بشكل رسمي."
لو سمحت انا وصاحبى رافعين قضيه عل الشركه اللى كنا شغالين فيها هل ينفع يشهد معايا أن الشركه طردتنى,"ومع ذلك، يجب عليك التأكد من ان صاحبك ليس لديه اي انتماء او ارتباط قضائى او شخصى مع الشركة الخصمة وان توضح له المخاطر والتزاماته كشاهد."
السلام عليكم أنا اشتريت شقة وبعد ما عملت التوكيل والعقد لقيت البايع بيتصل ويقول إنه رفع دعوي صحة توقيع عليا ولو محضرتش الجلسة هابقي ملزمة بدفع 20 الف غرامة مذكورة في العقد اعمل ايه,"إذا كان هناك أي إشكال في التواقيع أو الوثائق التي تم استخدامها ، فيجب عليك التحقق من تلك الوثائق مع المحامي الخاص بك."
السلام عليكم. عميله كانت اخده مني جهاز ب إيصالات امانه كل إيصال 5  الاف جنيهاجمالي المبلغ 30 الفدفعت 3 إيصالات منهم ومخدتهمش ومفترض الرابع كان من 5 شهور ومن الاخر بلطجت علينا واستتطيبتنا وفهمت اننا مش هناذيها فمبقتش تدفع وتكنسل في وشنا كمان الايصالات ال 6 معايا طبعا فيهم اللي متسجل باسمها ورقمها القومي وعنوانها  وفيه اسمها وعنوانها فقط  بس كلهم هي موقعه عليهم وبصمه ومش عارف اتصرفالفكره لو رفعت الباقي ليا بس منا هدفع مبلغ للمحامي يمكن بتمن شيك منهم ولو رفعت 4 مثلا علي اساس الرابع يكون للمحامي او جزء منه هبقي كدا بظلمهاممكن الافاده من حضراتكم التصرف ازاي خصوصا ان لا عايز ااذيها وكمان المكان بتاع ايتام  وانا عمهم فمش عايز اهضم حقهمشكرا جزيلا,"إذا لم تستجيب العميلة ، فيجب عليك الاتصال بمحامي مختص لرفع الدعوى القضائية ضد العميلة وطلب الحقوق المستحقة."
تم الاتفاق على شراء العقار بالكامل وتم توقيع العقد ولكن صاحب العقار رافض تسليم العقار,"إذا تم توقيع العقد، فإنه يجب على صاحب العقار تسليم العقار لصاحب الشراء وهذا حق قانوني."
من فضلكم لو فى شقه ورث من الاب  فيها اكثر من وريث واحد الورثه عايز يشترى نصيب وريث منهم ويبقى ضم نصيبه ليه ايه الاجراءات القانونيه من فضلكم ؟ معانا اعلان الوراثه للاب ومعانا عقد الشقه التمليك باسمه,"في هذه الحالة، يمكن للورثة الذي يرغب في شراء نصيب وريث آخر التوصل إلى اتفاق مع الورثة الآخرين بشأن شراء النصيب المرغوب فيه."
سلام انا شريت على واحد مداير ارض تجزئة مزال موجدلوش عقود  الان رايح يبعث باش يخرجولو عقود يقدر يبعث ارض تاعي لي شريتها عليه باسمي يخرج عقد باسمي ولا لازم  حتى يخرجو عقود باسمو باش يكتبلي قطعة تاعي و شكرا,"في حالة عدم وجود السند باسمك، قد يكون من الأفضل لك الاتصال بمحامي للتحقق من الحالة القانونية والاستشارة حول الخطوات المطلوبة للحصول على العقد الرسمي باسمك."
لو سمحت احنا اشترينا شقه فى بيت قديم بس حاله البيت كانت تبدو كويسه جدا وعادى ودفعنا فلوسها كامله وجينا بنعمل تعديلات فيها السكان إلى فيها زعقوا وقالو أن البيت عليه حكم ترميم وأنه البيت محتاج عماويد وحاجات كتير وطبعا إلى اشترينا منه الشقه مقالش كل الكلام ده قبل مانشترى ولا فهمنا واخد الفلوس كلها وفعلا الشقه بالوضع ده متساويش المبلغ إلى اخده هل فى اى حل قانونى نرجع بيه فلوسنا أو حتى جزء منها بحيث نرمم البيت ولا نعمل ايه اتضحك علينا وخايفين نروح نعيش فيها ومالناش مكان غيرها وخايفين برضو يبيعها لحد تانى لانه معاه اصل العقد لأن الشقه ورث من اهله ومرضاش يدينا الأصل وادانا صور,يجب عليك الوصول إلى صور ووثائق وما إلى ذلك لتوثيق حالة المنزل كما كانت عند الشراء وتقديم هذه الوثائق للمحامي الخاص بك لمساعدتك في تقديم دعوى قانونية.
السلام عليك بعد اذن حضرتك ممكن إستشارة قانونية احنا حصلنا على قرار تمكين لشقة الزوجيه بمشاركة الزوج و التنفيذ عن قريبولكن وصلنا من الجيران ان الزوج قام بخلع جميع الابواب و الشبابيك و قطع الكهرباء و المياه عن الشقهكمان كسر بلاط الصاله بحجة توضيب الشقه و سابها كده علشان يقول انه بيعمل تجديد هل فيه إجراء قانوني ممكن اعمله . وللا خلاص كده أمر واقعوشكرا لحضرتك,"أولاً، يجب عليك الاطلاع على العقد الزواج وملكية الشقة وكذلك التركيب العام للعقار لمعرفة حقوقك وحقوق الزوج."
