text,papers
"بصراحة صعيب تنتهي علاقتك بإنسانة كنت كتشوف الحياة غتبنيها جنبها ،عمرني فكرت غدي نطلق ..كنت ديما كنشوف سعادتي حدا هديك الانسانة اللي تفارقت معها ..من بعد الفراق دخلت في اكتئاب وظلامت الدنيا في عيني ..أنا عارف بلي بزاف ديال الناس عاشو هذ الشعور..دبا مدة مبقاش التواصل بيني وبينها ولكن اقسم بالله دائما في بالي ديما كنفكر فيها ... الإنسان كيحب مرة واحدة ومن بعدها معمرو يقدر يحب.","ثالثاً، يجب عليك التحدث مع محاميك لمعرفة المساطر القانونية الدقيقة لرفع الدعوى القضائية وفي ما يتعلق بالمستندات والإجراءات اللازمة."
السلام عليكم جد اولادي الأيتام توفي وابوهم مات الاول قبل جدهم وليس لدينا دخل ولا معاش من والدهم لكن جدهم عنده معاش كبير وانا لسه ولادي صغيرين ممكن بالله عليكم حد يفيدني ازاي ادخل اولادي في المعاش وشكرا ليكم,عليك التوجه لمكتب الضمان الاجتماعي المحلي في منطقتكم وتقديم طلب لتسجيل الأطفال في المعاش الخاص بجدهم.
لو سمحتوا هو ممكن الزوج يستخدم قسيمه الجواز  وبطاقه الزوجه ف ايه,"إذا كان الزوج يريد رفع قضية ضد زوجته، فيمكنه استخدام قسيمة الجواز لإثبات أنه متزوج من الزوجة المعنية، واستخدام بطاقة الزوجة لإثبات هويتها."
السلام عليكم. ممكن اعرف الولايه التعليميه بتترفض فعلا لما يكون لسه مفيش طلاق؟. المحامي قالي اترفضت عشان لسه مفيش طلاق وده بيبقي في اختلاف بين القضاه مش كلهم بيرفضو. وهل لو رفعت حضانه ليها اهميه ولو رفعتها قبل الطلاق هتترفض برده؟. كمان المحامي بيقولي ان الطلاق للشقاق ممكن القاضي ميقبلوش الا لما يحول للتحقيق الاولا ونجيب اتنين شهود عشان يعرف فعلا انه مش امين عليا واالا لا مع ان فيه محضر بتقرير بالضرب… See more,"وبالنسبة لرفع الحضانة قبل الطلاق، فلا يمكن الحكم عليها بشكل عام، فكل حالة لها ظروفها الخاصة."
السلام عليكم. اتجوزت من سنتين وعندي ولد وكان زوجة كويسة وطبعا في المشاكل العادية اللي بين اي اتنين وطبعا عشان مطورش من المشكلة واكظم غيظي كنت مش بتكلم معاها غير الشديد القوي وطبعا كل مشكلة كنت بسعي لحالها ونتفق وخلاص ومع الأسف ربنا كان وعدني بواحدة بتشيل مش بتنسي واكتشفت ان أهلها عارفين المشاكل اللي بينا وراحت عند اهلها ع سبيل تهدي الأمور بينا ومع الأسف الام اتدخلت وكانت في صف بنتها ومع ذلك رجعتها البيت وعطيت فرصة وسمعتها بس راجعة واحدة تانية خالص بقيت بتتكلم في فلوس ومصروفي ش… See more,يمكنك جمع الأدلة التي تشير إلى عدم استقرار الموقف الزوجي ووجود خلافات عائلية تاثر سلباً على حياتك وحياة أسرتك.
بعد اذن الاعضاء افيدوني. عليا اكتر من حكم منهم حكم تبديد في نفقه متعه وعده وعملت معارضة وخلصت . هل لو اتحبست برضو هسدد الفلوس,"إذا كنت قد تقدمت بمعارضة لقرارات الحكم السابقة وتم قبولها وتغيير الحكم لصالحك، فلا يوجد سبب لدفع الأموال المرتبطة بتلك القرارات، لأن هذه الحكم قد تم تبديدها بشكل قانوني."
معي متجمد نفقه زوجيه هل لو رفعت خلع المتجمد بيسقط فعلا ولا لا,"ولذلك، يجب عليك الاتصال بمحامي مختص في شؤون الأسرة وتقديم الأوراق اللازمة له لتقييم الحالة وتقديم النصيحة والتوجيه المناسب لك."
قضيه اجر مسكن وحضانه محامى الزوجه كاتب في عريضه الدعوى أن الزوجه مطلقه للضرر .وكانت الدعوى اتحجزت للحكم ولما روحنا نشوف الحكم من الأجندة اتأجلت للاستجواب . لان الزوجه لم ترفق بالمستندات حكم بالطلاق ونهائيته .. دلوقت هما كاتبين انها طلقت للضرر والحكم الطلاق اللى هايقدموه فى الجلسه الجايه طلاق للشقاق واستحكام الخلاف وليس طلاق للضرر . هل دا يفيد الزوج بحاجه أو يغير مسار القضيه ؟,"علاوة على ذلك، قد يؤدي هذا التغيير إلى طلبات جديدة من الأطراف وتعديل المطالب المقدمة في الدعوى، مما يجعل من الصعب تحديد مسار معين للقضية قبل الجلسة القادمة."
السلام عليكم. انا محتاجه مساعده او استشاره قانونيه بجد من فضلكوا من غير كلميني ع الخاص ورقم تليفونك ولا وكليني وانا هدبلك حقك ولا الكلام ده كله انا عاوزه حد ابن حلال يساعدنى قالى اربع سنين مطلقه بحكم محكمه بعد م طليقي سرق دهبي وعفشي كله خلى الشقه ع السيراميك وباع شقتى . واتجوز وخلف وعايش حياته وبقالى اربع سنين ف المحاكم مش عارفه اخد منه جنيه ولا نفقه ولا اي حق من حقوقي  اتحكملى ف كل القواضي وواخد احكام ف كل القواضي. ومش عارفين يمسكوه كل م محضر يروحله امه اللي ربنا ينتقم منها تقول مش موجود. ولا عارفه اخد جنيه من نفقه بنتى ...  نفسي اعرف ازاى القانون بتاعنا كده ازاى يحكملى بكل القواضي. ويسبنى في نص الطريق ولا عارفه اروح ولا ارجع  محامين مصو دمي فلوس وكل واحد يقولى اقل من سنه هجيبلك حقك وتعدى السنه ويقولولى نعمل ايه مش عارفين يمسكوة. انا معرفش هو فين. ولا قاعد ولا عايش فين روحت مليون مره المركز وقابلت الظابط والمأمور وروحت مديريه الامن ومقدمه شكوة ف البوابه الاليكترونيه مفيش اي استجابه خلاص حقي وحق بنتى ضاع. حسبي الله ونعم الوكيل انا عاوزه حد فاهم يفهمنى امشي ازاى ولا اروح فين,يمكن البحث عن محامي من خلال الاتصال بنقابة المحامين في مدينتك أو من خلال البحث عبر الإنترنت.
لو اكتشفت بعد الزواج ان زوجى عنده فصام وده نتيجة المخدرات وبناءا على كلام الدكتور ومكنش قايل لو هرفع قضية للطلاق ايه اللى هيتم وبتقعد قد ايه وخاصة ان وصلت بيه انه يشك ف شرفى واخلاقى ؟. وقضية طلاق للضرر بتاخد وقت قد ايه عشان اضمن حقى,"لإثبات الفصام كمسوغ لطلب الطلاق، فإنه يجب توفير الأدلة الكافية والوثائق الطبية والتقارير النفسية التي تثبت وجود المرض لدى الزوج."
من فضلكم زوجه توفت بعد زوجها ولها بنتين فقط وعدد  اخوات  ذكور وبنت واحده وفى منزل ورثه من امها نصيبها ف المنزل من الأمتار  متر وسم .. كم عدد الامتار الخاصه بكل وريث من الاولاد والاخوات؟  وشكرا,"وبما أن قيمة المنزل هي 100 متر مربع، فإن كل واحد من الورثة سيحصل على حصة تساوي (100/4=25) متر مربع."
كان فيه استئناف نفقة لبنتي وايد حكم أول درجة فطلع له صورة رسمية من الحكم واستلمته. هل لازم اعلن بالصورة الرسمية برضه قبل مارفع دعوى الحبس ولا لأ؟ . انا عملت اعلان لما استلمت حكم أول درجة,"ومع ذلك، ينصح بالاحتفاظ بصورة الحكم الأصلية وجميع الوثائق المتعلقة بالقضية في ملف يمكن الوصول إليه بسهولة في حال تم طلبه فيما بعد."
سؤال ضروري لو سمحتم. لو تم الاتفاق إن الطلاق ودي. إزاى الزوج يضمن إن الزوجه تجيب الطفل في المكان الجديد المتفق عليه للرؤية ؟,"وفي حالة عدم الامتثال للاتفاق، يمكن للزوج تقديم شكوى للمحكمة وطلب إجراءات قانونية تجاه الزوجة من حيث عدم الامتثال للاتفاق."
السلام عليكم ياجماعه ايه الحل فى الزوج الى بقالو سنتين مش بيدفع نفقه وبتوع التنفيذ بيقولو ان مش موجود نهائى اتعامل ازاى مع الناس الى هما بيكزوبو ويقولو مش موجود وفى حل اقدر من خلاله احصل على حقى تعديل ياجماعه هو قضيه متجمد النفقه ليها تحريات,"ولكن يجب ان تكون الأوراق المقدمة كافية وصحيحة والتحريات في مكانها، يفضل استشارة محامي مختص في الشئون القانونية الأسرية للحصول على المساعدة اللازمة."
"مطلقة تزوجت وكان معاها حضانة ابنها هل بعد زوجها تتنقل حضانة الطفل لأمها ولا فى إجراء نقل حضانة ،، ومين المفروض يرفع زيادة نفقة هى ولا امها ؟؟","وفي حال تم تغيير الحالة العائلية للأم، فيجب إعلام المحكمة بتغييرها لدراسة احتمال تغيير حالة الحضانة."
بعد صباح الخير .... الزوج المانى الجنسية مسيحى ارذوذكسى (كان مصرى وتنازل عن الجنسية المصرية). الزوجة مصرية الجنسية مسيحية انجيلية. تم الزواج داخل مصر والزوج يحمل الجنسية الالمانية  .. زواج مدنى فقط موثق .. دون اتمام الزواج داخل الكنيسة .. الزوج يريد الطلاق بالارادة المنفردة .. الزوج عمل توكيل محاماه وسافر ماهى الإجراءات للطلاق.. وشكرا مقدما.,"وفقًا للقانون المصري، يمكن للزوج الذي يرغب في الطلاق الحصول عليه بالرغم من عدم وجود موافقة من الزوجة، وذلك بشرط دفع التعويض وفقًا للاتفاقات التي يتم التوصل إليها."
السلام عليكم. الام تزوجت وانتقلت الحضانه الى امها ولاكن مزال ابنى يعيش مع الام وزوجها وتم تقديم للطفل في مدرسة تجريبى فى دائره سكن زوجيه الام وليس دائرة سكن ام الام الحاضنة هل ده سبب كافى لاثبات ان الطفل مازال في حضانه امه واسقاط الحضانه عن ام الام؟,"ويمكن للمحامي الاستشارة بمزيد من التفاصيل حول الحالة الخاصة بالعميل والقضية التي يود تقديمها، وهذه المعلومات يمكن استخدامها لتقديم الأوراق اللازمة لتحقيق المصلحة القانونية للعميل."
السلام عليكم لو سمحتو انا حصلت مشاكل بينى وبين سلفتى وربنا اللى عالم هى انسانه زباله ازاى المهم راحت عملت محضر انى انا وزوجى ضربناها الناس قالتلى روحى اعملى قصادها محضر روحت عملت فيها هى وبنتها بعد ايام لانهم مسابونيش فى حالى دلوقتى انا جايلى حكم  شهر انا وزوجى ج غرامه وعملنا استئناف ولما سالت عن محضرى اللى عملته فيهم لقيتهم لسه متحكمش فى قضيتهم عاوزه اعرف متحكمش ليه وكمان وضعى انا وزوجى ايه ممكن يتامم الحكم فعلا ولا لا لانى مش فاهمه حاجه من المحامى بتاعنا بصراحه,"وأخيرًا، يجب الاستعداد لأي نتيجة يمكن أن تأتي في حالة صدور الحكم ضدكما، وقد يتم تغريمكما أو إرسالكما إلى السجن في بعض الحالات."
لو الزوجه تركت منزل الزوجية والدهب معاها. هل محكمة  اكتوبر جيزة القاضي بيحكم ان الدهب لصيق الزوجة ولا الراجل يدفعة تاني,"إذا كان هناك اتفاق سابق بين الزوجين بشأن القضية، فيكون من الممكن حل النزاع بالاتفاق بشأن ملكية الذهب."
السلام عليكم ورحمة الله وبركاته انا اليوم كسبت قضايا النشوز اليوم هل ممكن ارفع ع الزوجة قضية تعويض,"فيما يخص قضية التعويض، فإذا كانت الزوجة قد تسببت في الضرر لك وأصبح لديك خسائر مادية أو معنوية بسبب تصرفاتها، فبالطبع يحق لك رفع دعوى تعويض عليها."
الزوجة ترغب بالطلاق و لكنها ترفض التنازل عن حق المتعة او انه يشوف اولاده . الزوج خايف من تبعات الطلاق الغيابي وهو يعمل في دولة اخرى. ايه الحل؟,"في حال عدم التوصل إلى اتفاق يمكن رفع دعوى قضائية لإجبار الحصول على حقوق الطرفين وتقرير موقف الأولاد، ويجب الاستعانة بمحامٍ ذو خبرة في القضايا الأسرية."
ممكن اعرف لو دخل الاب زاد % نسبة زيادة نفقة الصغيره تبقي كلم,"ومع ذلك، يجب على الأب تقديم طلب رسمي إلى المحكمة لتحديد أي زيادة في النفقة والتي يجب أن يتم دراستها والاستماع إلى جميع الأدلة قبل اتخاذ قرار المحكمة."
مساء الخير ..اتحكم للزوجة نفقة . وبالنسبة للمتجمد ..هى مش عايزة تقسط المبلغ وعايزاه كله ...وكمان مش عايزة تاخد جزء وتمضى على وصل استلام قدامى ...وعايزة ترفع دعوى حبس . السؤال بقى لو رفعت دعوة حبس ايه اللى ممكن اضر منه انا ؟… See more,"بشأن الإجراءات القانونية المتعلقة بنفقة الزوجة، فيجب التأكد من جمع كافة الأدلة والإثباتات المتعلقة بالموضوع وتقديمها إلى المحكمة، وفي حالة الرفض، يمكن اللجوء إلى المحامي لمتابعة الإجراءات القانونية اللازمة."
السلام عليكم ممكن استفسار لو سمحتو. انا دلوقتى عليا نفقه مسكن ومأكل الف ونص وعليا الف نفقه متعه وونص نفقه عدة وطبعا هى رافعه القايمه وهى عملت طلاق للشقاق والقاضى طلق. فى ناس بتيجيلى من النقطه عشان يخدونى او ادفع الالف ونص حاليا وروحت للمحامى بتاعى وكلم المحاميه بتاعت الزوجه عشان نحلها ونخلص طبعا المحاميه قالت للمحامى بتاعى هشوف اخوها وارد عليك ولغايه دلوقتى محدش بيرد عليا والمحامى بيقولى لسه محدش رد من الواضح مش عايزين يردو والحكومه كل شويه عندى. المفروض ايه اللى انا ا… See more,يجب عليك التأكد من تقديم جميع الأوراق اللازمة والدلائل التي تدعم حقك في تغيير القرار القضائي السابق.
لو اتعمل طرد وتم التمكين  بتحقيق وشهاده الشهود واترفض الطرد واثبت صوريه العقد المفروش . والشقه باسم والد الزوج . وتم عمل قضيه طرد جديده تاني,"يجب تقديم هذه الأدلة والوثائق مع طلب الطعن لدى المحكمة المختصة، وتبرير أسباب الطعن وتوضيح المطالب المراد الحصول عليها، وسيتم تقييم الأدلة والوثائق لاتخاذ القرار النهائي بناءً عليها."
قضية تبديد منقولات خد  شهور حكم نهائي ومحبوس على ذمة جنايه دلوقت بعت لنا اعلان انذار عرض روحنا نستلم مالقيناش حاجه عملنا محضر إثبات حاله أمه عملت نقض وعيطت للقاضى اننا عايزين نحبسه ومش عايزين نستلم القاضى عمل ايقاف تنفيذ عايزه أعمل شكوى فى التفتيش القضائي ممكن حد يتكرم ويقولى المحتوى,"بناءً على الوصف الذي قدمته، يمكن رفع قضية جنح بتهمة التبديد بحق الشخص الذي تعرّضت له الأموال."
السلام عليكم . بعد إذن المحامين انا جدي مأذون واتوفي . الان انا طالب في السنه الاخيره باحدي الكليات الشرعيه بجامعة الأزهر . هل يجوز أقدم ع الماذونيه واخدها انا ولا يشترط اكون مخلص كليه والخدمه العسكرية . ارجوا الرد من المختصين في هذا المجال … See more,"وعليكم السلام ورحمة الله وبركاته، بالنسبة لحصولك على تفويض مزاولة المهنة كمأذون شرعي، فالشروط تختلف من دولة لأخرى، ويمكن الاستعلام عنها لدى الجهات المعنية في بلدك."
بعد اذنكم عندي استفسار بعد دعوي حبس في متجمد نفقه ايه اللي يضمنلي انو يلتزم كل شهر ولا لازم كل فتره ارفع دعوي بالمتجمدايه يخليني اخد النفقه كل شهر وازاي انفذكل شهر,"إذا تم حكم بحبس الشخص الملزم بدفع النفقة، فيمكن للمحامي رفع دعوى استعجالية للحصول على إخلاء الحبس بدفع مبلغ النفقة المستحقة للفترة الحالية والمستقبلية."
هو الخلع ليه نفقة؟ انا اسف حاسس ان السؤال تافه بس انا بجد مش عارف شكرا لصاحب الرد,وتتحدد المبالغ المطلوبة للنفقة بناءً على الدخل الشهري للزوج والمعيشة المعتادة للزوجة.
السلام عليكم ورحمة الله وبركاته. لو سمحت ممكن اعرف سن خروج صاحب العمل على المعاش  سنه ولا . ولو عامل يطلع على سن كام. ورشة حداده,وعمومًا يمكن للعامل الاستفسار من صندوق التقاعد أو الجهة المسؤولة عن تحديد سن التقاعد والشروط المطلوبة للحصول على المعاش التقاعدي.
زوجة صدر ضدها حكم نشوز واسقاط المفروض من النفقة قامت رفعة دعوى حبس بمتجمد النفقة  بإعلانات مفبركة وصدر لصالحها حكم بحبس الزوج ثلاثون يوم . الرد من الزملاء المحامين . افضل حل قانونى لهذة المشكلة,"وفي حال ثبوت إثبات كلما ذكر، يمكن تقديم طلب للمحكمة لإلغاء حكم الحبس والتمسك بمتطلبات النفقة المقررة قانونًا."
السلام عليكم. قضيه ضم وحضانه بتاخد قد ايه في المحكمه وايه الاوراق المطلوبه وتنفع في مكتب التموين عشان أضم اطفال للبطاقه,"أما بشأن استضافة الأطفال في بطاقة التموين، فيمكن الاتصال بمكتب التموين في البلد المعني للحصول على المعلومات المطلوبة والأوراق المطلوبة الإنجاز للإجراء."
السلام عليكم. ممكن محامى ضرورى يفدنا ف موضوع دا. انا صحبتى جوزها طلقها ومعها بنتين سن  و سنة وعندو بيت باعو لاخوة عشان مسافر وكتب ورقة على نفسة ان طلقتو واولادة ياخدو نفقة واجر مسكن بملغ وتم موافقة من زوجة اخوة ما رضى ان عيال اخوة يمشو من بيت فاجر ليهم ايجار سورى وفضلوف البيت معهم لانة دورين  لاسف الام رفعت تمكين عشان تاخد البيت كلة وتطرد اخووة مع العلم الببت باسم اخووة دلوقتى . وفعلا بتمكين اخدتو واخووة انطرد الحل ف دعووة رافعها محامى بطرد الام ليرجع بيت للاخووة واخد امر اخر… See more,"ثانياً، يجب على المحامي التحقق من الوثائق التي حصل عليها جوز صديقتك عندما باع المنزل، وما إذا كانت تحل محل بعض الأزمات التي يمكن أن تنشأ عن الحالة الحالية."
انا رفعه قضيه نفقه وقايمه على جوزي هاجرني من  شهور بدون اي مصاريف ولا سكن ولا اكل ولا لبس كل شويه المحامي يقول لي حكمت ب القايمه وانا اقول هات حكم القايمه يقول  اصبري شويه اخذ مني  مقدما انا لا يوجد معي اطفال منه واخر حاجه قالهي المحامي حكمت ب  جنيه هو كذب علي مش راضي يديني اي حكم بالقايمه وقال  حكمت بالقايمه اعمل ايه انا دلوقتي عايزه حقي من المحامي,"إذا كان المحامي لا يستجيب لطلباتك ولا يأخذك بجدية، فإنه من الممكن التفكير في تغيير المحامي والعمل مع شخص آخر يتمتع بأكثر شفافية ومصداقية."
انا موظف ومرتبى  ومعنديش اى املاك او اراضى والقاضى حكم عليا بنفقة للزوجة مأكل وملبس ومسكن  ونفقة للولدين ماكل وملبس  يعنى اجمالى  جنيه . المبلغ ده مش كبير ؟ وايه اللى المفروض اعمله دلوقتى افضل... وهل لو هى رفعت استئناف وانا مرفعتش ..ممكن يزيد تانى ؟. ....افيدونى,"إذا كان زواجك يخضع لقانون الأحوال الشخصية المصري، فيمكنك الاتصال بالمجلس القومي للمرأة للدفاع عن حقوق المرأة فيما يتعلق بنفقة الزوجة والأولاد."
مطلوب للعمل بمكتب محاماه بالنقض محامين ابتدائي او جدول عام يفضل الكتابه علي الكمبيوتر من الجنسين مساء الرتب بعد المقابله بشارع الشيخ ريحان عابدين القاهره للتواصل ,"إذا كنت تريد رفع قضية، فيمكنني تزويدك بقائمة بالأوراق القانونية اللازمة لتقديمها إلى المحكمة وذلك يتوقف على نوع القضية المراد رفعها والجهة التي تريد الرفع عليها."
ما هى اجراءات وخطوات طلب افراغ الكاميرات المقدم للنيابة لتنفيذه ؟,"5- توقيع اتفاقية إفراغ الكاميرات: يتم توقيع اتفاقية إفراغ الكاميرات بينك وبين النيابة المختصة، وتحديد موعد لاستلامها."
