text,papers
أن سمحتم انا دلوقتي طليقتي اتجوزيت وبنتي مع جديتها وليها خال متزوج سوابق والمحامي بيقلي اخطفها ونفسي اخد حضانه البنت في اي طريقه أن سمحتم أحدها بيها أو اقدر اسبت أن البيئيه الي فيها غير مناسبه ليها واخد الحضانه لاختي مثل,ومن الأفضل أن تتحدث مع محامي متخصص في قضايا الأسرة يمكنه تحليل الوضع بشكل كامل والإجابة على أي أسئلة لديك بشأن الحقوق القانونية المناسبة.
انا سيده عندي شقه ايجار محدد المدة ٥٠ سنه من ٢٠٠٦ هل يجوز لي أن ازوج ابني في الشقه,"لذلك، فإن تزويج ابنك في الشقة قد يعد تغييرًا في استخدام الشقة التي يحتوي عليها العقد، وربما ينطوي على مخاطرة في تفسير العقد."
هل في وقت معين بعد الطلاق لو مرفعتش قضايا بالمؤخر والمتعة بيسقط حقها بالمطالبة بيهم,ولكن يجب أن يتم رفع الدعوى خلال فترة العدول في القضايا المدنية المعمول بها حسب القانون المعمول به في بلدك.
أعزائي  الرجال...تعالى نحسبها صح...زى ما الستات بتحسبها بالمليم...سيادتك عايز تتجوز...العروسة  هتطلب شبكه اقل حاجه١٠٠جرام   يعنى ٨٠ الف جنيه...هتقولها هناخد شقة ايجار ...مش هترضى...هتقولك تمليك...فى الشارع اللى ورا شارع امى....العفش   هدخلك فى حيطه...وهتقولك حجرة اطفال وخلافه...الفرح...هتقولك لازم الفرح...هو انا هجوز كل يوم...يعنى بالبلدى...سيادتك عاوز   على الاقل لما تكون فقير دقه  ...نص مليون جنيه...وبعد ما تحمل...هتلاقى  وش تانى...هتعمل كل حاجه لنفسك...اذا كان عاجبك....والا المدام حاضنه...هترفسك برا الشقه...وهترفع عليك خلع...يوم ما تمسك نفسك عن طلاقها...وتاخد القايمه...والشقه...ما هى حاضنه بقى...وهتاخد المؤخر ...ونفقه متعه...اقل حاجه١٥ الف جنيه...وهتطردك برا الشقة...اللى انت طفحت الدم عشان تجيب كل يوم طوبه فيها...ولما العيال تكبر...هتكرهم فيك...وهتبقى اوحش واغلظ اب فى العالم...وانت السبب فى الكورونا...ونفقه الاطفال اوعى تنساها....والشبكه....كله رايح....عليه العوض...واقسى طموحاتك انك تشوف عيالك ساعتين فى الاسبوع فى الحديقه العامه...طب وهى بقى...خلاص خدت اللى هى عايزاة...ما هى ناس تتعب ...وستات تاخد ع الجاهز...وربنا يديك الصحه وطوله العمر ...عشان ترجع تحوش وتشترى شقه تمليك....وترجع تبقى زبون لواحدة تانيه....ماهو احنا مش بتوع حداد...احنا دمنا وتعبنا  احلى م الكباب.....هتسألنى طب ايه الحل.... هقولك....هتروح لشركه سياحه....تاخد رحلة لروسيا او اى دوله من الاتحاد السوفيتى السابق...فيها مسلمين كتيير....هتسافر فى الرحله...واكيد هتقابل بنات ملكات جمال...مش زى الجعافرة اللى حدانا فى مصر...مش لاقى...هتدخل اى جامع هناك...وتقولهم انا مصرى وابحث عن زوجه مسلمه....الف مين هيرحب بيك....هتدخل بيتهم   ...وفى الغالب بيبقوا ناس طيبين...مش هيطلبوا منك تقطف القمر ليها...لا فيه قايمه ولا نايمه....هتجوزها بشنطه هدومها...بكر ...لم تتزوج من قبل..سيبك من اللى بيقولك...انهم سايبين على بعض....لا ...هناك زى هنا...فيه اللى بتحافظ على نفسها وفيه الشمال.... المميزات....هتجيب قمر ١٤...لا مكياج ولا يحزنون...ومش هتتخض فى الصباحيه زى خضه احمد زاهر فى مسلسل البرنس....لو قلبت فى التليفزيون ...مش هتتفرج على رضوى الشربينى...صاحبه الفضل الاول فى خراب بيوت مصر...هتعلمها عربى على مزاجك...واوعى تسمع..لواحدة تقولك مين اللى هيعلم عيالك...كدة كدة..العيال بتاخد دروس...والستات بيكسلوا يدرسوا لعيالهم...هتبقى انت جوزها وابوها وعيلتها كلها..ولو جبت بنات....هيطلعوا قمرات...وكدة كدة مش هتغضب....هتروح فين...انت كل عيلتها....فوايد كتير كتييييير...وافتكر انك بتتبع الدين...والرسول صلى الله عليه وسلم حضنا على الزواج من العائلات البعيدة وليس القريبه....واظن مافيش ابعد من روسيا...ارحم نفسك واسمع كلامى وماتغلطش زى عب السميع....مين هو عب السميع.......دا واحد صاحبى غلط وماجوزش  روسيه مسلمه..... كل اللى انا قلته عن تجربه حياتيه...توكلوا على الله...... كل الحكايه رحله سياحيه لروسيا ب ١٥ الف جنية.....وسيبوهم للخلايجه   ...يجيبوله الفلل فى التجمع .... احسن حاجه يا جماعه نريح بنات مصر خالص من قرف الزواج والقايمه وحرب مارى منيب اللى مابتخلصشى....ونجمع بعض كرجاله ....ونعمل رحله جماعيه لاوزباكستان او اى دوله مسلمه من دول جوار روسيا...ونتوكل على الله ونتجوز من هناك...الرحله مش هتتكلف اكتر من ١٥ الف جنيه....بس نروح مجموعه...وهناك نقعد شهر....ندور على بنات الحلال...واكيد هنلاقى...وهيبقى زواج اسلامى...بدون تعقيدات.....يلا بينا يا رجال مصر الاوفياء....شير خليه يوصل انه يبقى ترند...مش قادرين على طلبات ستات مصر..... ..اخوكم...وليد ابو على..,"من المهم التحري عن الشخصية والخلفية الاجتماعية والثقافية للشريك المحتمل، والتأكد من أنه يتوافق مع قيمك ومعتقداتك، بدلاً من البحث عن حلول سهلة وغير مسؤولة."
أنا عامل أجري وزجتي رفعت عليا قضية طلاق للضرر ورقني الله منها طفله وأنا بأخذ ٥٠٠جنيه منحة العماله الغير منتظمه . سؤالي . في هذه الحاله ماذا يحكم القاضي في هذه الحاله. ياريت الأجابه تكون من الأساتذه المحامين المحترمين,"ويجب عليك الاتصال بمحامي متخصص للحصول على نصيحة قانونية حول المسألة بالكامل، لأن هناك العديد من الظروف المشتركة والفردية التي يتم النظر فيها في حالة القضايا الزوجية."
دعوي اسقاط الحضانه عن الام بسبب اهمال الاولاد. هل شرط اقامتها بعد شهور العدة او ممكن اقامتها بعد الطلاق مباشرة؟؟,"ويمكن للأم المطلقة الذهاب إلى المحكمة المختصة بالأحوال الشخصية ورفع دعوى لاسقاط الحضانة عن الأب، على أساس انه لم يحقق الأب الأمان المطلوب للأولاد منذ فصل الزوجة الملتزمة برعايتهم."
هي لو حاجات مش مكتوبه ف القايمه ساعه التسليم ممكن اخدها لو الطرف التاني قال بتاعتها,"وفي حال عدم معرفتك لجميع الأوراق المطلوبة، يمكنك التواصل مع الطرف الآخر للاستفسار عن تفاصيل إضافية والتأكد من استيفاء جميع الأوراق اللازمة لرفع القضية."
السلام عليكم . كان في حكم غيابي سنة و١٠٠٠ كفالة جنحة تبديد منقولات . وتم عمل معارضة ونزل جلسة في شهر سبتمبر . ممكن اعرف ايه الي هيتم . وهل في مدة معينة للاستئناف ولا بعد ٤٠ يوم من الاعلان بيكون الحكم نهائي ؟؟. ممكن التوضيح بعد اذنكم,"بالنسبة لجلسة الاعتراض الخاصة بك، فإنه يجب عليك التواصل مع محاميك المختص لمعرفة تفاصيل أكثر حول إجراءات جلسة الاعتراض وما تحتاجه من وثائق وأدلة للدفاع عن حالتك."
ما هي الخطوات بعد الإنذارات و عدم دفع النفقات و للموؤخر و العلاج؟,"وفي حالة عدم التوصل إلى اتفاق، فسيكون عليه الحصول على دعم قانوني لمناقشة الوضع في المحكمة وحل النزاع بشكل قانوني."
هل هناك فرق بين أجر الحضانة وأجر الحاضنة ولا كلاهما واحد وهل هو من حق الصغير ولا من الزوجة,"أجر الحضانة يعني الأم التي تحتفظ بطفلها الرضيع وتعتني به، بينما أجر الحاضنة يعني المرأة التي تعتني بطفل ليس لها وتقوم برعايته."
هو بنك ناصر بيصرف لو الزوج مسافر خارج مصر بس عنده املاك في مصر,ويمكن للمحامي الذي ينوي رفع قضية الاستعلام عن الأوراق المطلوبة لذلك.
أنا زوجتي هربت من البيت وراحت عند أهله ولما روحت ارجعها مرضوش وخدت ابني وحولت كتير بس عرفت انها بتحب حد تاني قولت لأهلها تعالو نخلص من الموضوع وكل واحد يروح لحالة مرضوش واشتكوني فرحت مطلقها غيابي وهما سكيني بلقيمه ومتعه ونفقه وماهر ودهب وانا علي باب الله اعمل اه,"أولاً، يجب عليك البحث عن خيارات التسوية الودية لهذه المشكلة والتحدث مع زوجتك وأهلها بشكل مهذب لمحاولة إيجاد حل يناسب الجميع."
ليا استشاره قانونيه لو زوج رافع علي زوجته دعوي بطلان  عقد زواج بعد ما كسبت دعوي طلاق للضرر عليه وبيطالب بحرمتها من حقوقها الشرعيه والماليه نتيجه الي الغش والتدليس دي بيتاخد بيها وبيتاثر علي حكم الطلاق انه يتايد في الاستئناف ولا بتفضل متعلقه . وهل قضايا الغش والتدليس دي بتثبت فعلا,"- إذا كان الزوج يود تطبيق حكم بطلان العقد بعد حصوله على حكم الطلاق، فستكون هناك حاجة إلى دليل قوي يثبت وجود الغش والتدليس في العقد في الأصل."
حكم نفقه صادر بتاريخ 31/10 مواعيد الطعن ب الاستئناف بتبدأ من نفس اليوم ولا من اليوم التالي لتاريخ صدور الحكم. هل من حق المدعي الطعن ب الاستئناف ف اليوم الاخير من ال 40 يوم. ارجو الرد ضروري,"في حالتك، إذا كان الحكم صدر بتاريخ 31/10، فإن أخر يوم لتقديم الاستئناف هو الثلاثاء 10 ديسمبر (40 يومًا من تاريخ صدور الحكم)."
"بعد اذن الساده الافاضل. دلوقتي عندي قضيه ابن رافع علي ابوه زياده نفقه لأنه مازال في مراحل التعليم .. فدخل المدعي عليه وقال بأن ابنه بيشتغل وطلب التحريات و جاءت التحريات بأنه طالب ولايعمل وفي الجلسه وانا بقدم التحري اتفاجئت ان الخصم بيقدم تحري ثاني بيقول انه طالب و يعمل و دخله 2500 شهريا. فرفضت دعوي اول درجه ، ورفعت استئناف وجاءت تحريات المديريه بتقول انه بيعمل ودخلوا 2,000 ونصف بردو. ايه الحل حاليا ؟. مع العلم ان والده حاليا رفع دعوى ايقاف مفروض نفقه بناء على تحريات دي. زائد ان انا اشتكيت في المديريه عشان التحريات تيجي مظبوطه بس للاسف مفيش ضمير. ما العمل ؟","ثانياً، يجب تحديد نوع الدعوى التي تم رفعها بالفعل من قبل الأب، إذا كانت دعوى إيقاف مفروض نفقة، فيجب الاهتمام بتحديد أسباب طلب الإيقاف ومعرفة مدى صحتها وقانونيتها."
من فضل الساده المحامين عندي سؤال انا أطلقت من سنه ونص ومعايا بنتي ليها ظروف خاصه وعلاج شهري وفي وقت الطلاق اتعمل عقد اتفاق بالنفقه الشهريه وتم توثيق العقد ده في  المحكمه وأشارت عليه وبالفعل الأب لم يقوم بدفع النفقه   ولما جايت اعمل تنفيذ من المحكمه لعدم دفعه قالوا ليا مش هينفع علشان انا مش اخدت حكم بالنفقه من المحكمه وبالفعل رفعت قضيه من اول وجديد قضيه تسويه بالنفقه وفضلت مايقرب من سنه حتى الآن لم اخد حكم السؤال هو انا المتجمد اللي فات ده كله يتحسب ليا من تاريخ العقد ينفع ترفع قضيه بيه ولا مش بيتحسب المتجمد الا بعد حكم المحكمه بالنفقه. وأهلي طليقي للأسف بيسوموني دلوقتي بعد سنه انهم يدوني النفقه الشهريه وأمضى بإيصال  بآخر شهر ليهم واني اتنازل عن المتجمد وانا دلوقتي في حيره لاني مش معايا فلوس خالص وعليه فلوس فلو اخدت منهم النفقه بتاعت الشهر ده ومضبت إيصال بشهر ده كده بلغي المتجمد بتاع  السنه  كلها ويروح عليه.. واسفه على الاطاله في الموضوع,"وإذا لم تتمكني من دفع النفقة عن هذا الشهر، فيمكنك ذكر ذلك لأهلي طليقك والاتفاق معهم على طريقة دفع النفقة في وقت لاحق."
السلام عليكم ممكن أعرف الورق مطلوب للرفع قضيه طلاق بعد فقد الامل في الاصلاح,عليكم مراجعة مكتب محاماة معتمد لمعرفة المزيد من التفاصيل والإرشادات حول كيفية رفع القضية بنجاح.
سؤال. حصل خلاف بيني وزوجتي ورفعت عليا مجموعه قضايا منها تبديد المنقولات وجه حكم سنه حبس مع اني انا اللي ترك شقه الزوجيه ولم اخذ شيئا ومعملتش اثبات حاله في القسم اعمل ايه,"ثانياً، في حال كانت هناك قضية مرفوعة ضدك، فعليك التحرك سريعاً وتقديم دفاعك وتوضيح حقيقة الأمور وتقديم الأدلة اللازمة لإثبات براءتك من التهم التي وجهت لك."
السلام عليكم ورحمة الله وبركاته. للسادة المحامين. هل يجب الحصول على حكم نشوز للزوجة لرفع قضية إسقاط مفروض نفقة أم ممكن بدون هذا الحكم,"في بعض الدول، يتطلب القانون الحصول على حكم نشوز لتمكين الزوجة من رفع قضية إسقاط مفروض نفقة، في حين أنه في الدول الأخرى قد لا يلزم ذلك."
لو سمحت هى الولايه التعليميه ليها صيغه تنفيذيه ولا لا لان المحكمه طلعتلى صوره رسميه وختمتها ومكتوب عليها تمنح الولايه لام الطفل بس هل فى حاجه تانى ولا كده خلاص,"عادة ما تكون الصيغة التنفيذية مطلوبة لتنفيذ حكم المحكمة ولكن فيما يتعلق بحكم تحديد ولاية التعليم للطفل، فإن الصورة الرسمية التي أرسلتها المحكمة تعد كافية عادة."
لو تم رفع قضية رؤية ولم يتم وصول اعلان للمدعيه عليها بها وتم الحكم فيها هل حكم الرؤية يسقط الحق في نفقة الصغار,لا يتسقط حق النفقة على الأطفال في حالة عدم استدعاء المدعي عليها للمثول أمام المحكمة في قضية الرؤية.
برجاء الرد من السادة المحامين فقط. اذا تم التلاعب فى حكم تطليق للضرر  لصالح الزوجة - فماذا أفعل لأثبت ذلك التلاعب - حيث أنها تستخدم هذا الحكم فى مطالبات كالمؤخر والمتعة ؟,2- تقديم شكوى خامسة: يمكنك تقديم شكوى خامسة إلى النائب العام إذا كان التلاعب نتج عن تزوير الوثائق والمستندات المتعلقة بالحكم.
السلام عليكم . ممكن لو سمحت استفسر ع حاجه انا كنت مطلقه ومعايا طفله ورافعه داعوه حبس بقالى ٤شهور وانا دلوقتى اتجوزت هل القضيه هاتسقط عشان نقل الولايه لولدتى ولا اى ارجوا حد يفيدنى,"قد يؤثر الزواج الجديد على القضية وقد لا يؤثر، والأمر يعتمد على خصوصيات القضية والتشريعات المحلية في الولاية التي تقع فيها الدعوى."
لو سمحت أنا عندي مبلغ متجمد نفقة 10 شهور. جهة العمل قالتلي هتصرفه مع الراتب والمكآفات. بجد أقصى 40٪ من الراتب . طيب ال40٪ دول مبلغ 1650. والنفقة وأجر مسكن والحضانة إجمالي 1600 ج. ده معناه اني هاخد المتجمد 50 ج كل شهر . هل يحق لي  رفع قضية متجمد ؟,"نعم، يحق لك رفع قضية لاسترداد المبلغ المتجمد وتحويله إلى دفع النفقة وأجر المسكن والحضانة، خاصة إذا كان هناك تعهد من جهة العمل بصرف هذا المبلغ في هذه الأغراض."
"السلام عليكم ورحمة الله وبركاته . الاساتذه المحامين ، هو بنك ناصر بيطلب عقد الاتفاق اللى تم بيه فى الحكم ، انا مقدمه كل الاوراق ، وعلشان مكتوب فى الحكم ان اتحكم بمافرضه على نفسه بالعقد اللى تم بينا ،طلبوا منى العقد ده ،هل ده يصح ،لانى مش عارفه اجيب العقد ده وملفى هيقف كده فى بنك ناصر ،ولا الموظفه بتتلكك واعمل ايه .... شكرا مقدما","إذا كان هناك أي مشاكل فيما يتعلق بطلبك للحصول على العقد، يمكنك النظر في طلب مساعدة محامي للمساعدة في حل هذه المشكلة."
فى حاله رفع المطلقه قضيه اجر حضانه ومسكن  ورغم سابقه الفصل فى أجرة المسكن وتقديم مايفيد انتظام السداد شهريا. بالنسبه لاجر الحضانه ممكن يترفض ام يحكم القاضى فى جزئيه اجر الحضانه فقط. ارجو الرد من المختصين؟,"بشكل عام، يمكن أن يحدد المحكمة القرار المناسب فيما يتعلق بالإجراءات التي ترتبط بالحضانة والمسكن في إجراءات الطلاق، والقرارات تعتمد على حالة كل حالة بشكل فردي."
قبل التمكين قامت والدة الزوج بعمل عقد ايجار ليه . ان هو مأجر منها الشقة وان هو لايملك شئ في المنزل ورفعت قضية بإن ابنها مش بيدفع ليها ايجار وحاليا هو خارج البلد. دا يأثر علي التمكين للزوجة؟؟,"لذلك، ينصح بمراجعة محامي متخصص في الشؤون العقارية لتحديد الآثار القانونية للقضية القائمة وما إذا كان من الممكن أن يؤثر على عملية التمكين للزوجة."
"لو سمحت ممكن رد قانوني من الساده المحامين الاعزاء؟؟   . لو تم الاتفاق ع اتفاق ودي يشمل النفقه وكل مايخص الطفل وحقوق طليقتي الشرعيه وحق الاب ف المبيت للطفل ووجود شرط جزائي وتم توثيق الاتفاق بمكتب التسويه, واخلت الام بحق المبيت للطفل عند والده هل يجوز الزامها باستضافه الطفل بما وقعت عليه من الزام وتغريمها بالشرط الجزائي , ام سيقر القاضي بعدم الزامها بذلك وجوبا لعدم بعد الطفل عن الحاضن وعدم رضا الحاضن بالمبيت وبعد الطفل عنها؟؟   . ومن هنا اشتري دماغي واخليها ماشيه محاكم ؟؟  وشكرا جزيلا","أهلاً بك، يرجى العلم أن القاضي لديه صلاحية التقرر فيما إذا كان يجب على الأم استضافة الطفل أو لا، وذلك بناءً على مراعاة المصلحة العليا للطفل."
استاذ نا الكريم ما هي حقوق المرأة في قضية الخلع والتي عاشت عشر سنوات في تحمل وصبر حتى فاض  مش عارفة تتطلق للضرر هل لها متعه أو أي حقوق ولديها طفلان معها ارجو الرد القانوني من فضلك كما تعودنا منكم,"يمكن أيضًا للمرأة المطلقة الحصول على نفقة مؤقتة من الزوج في حالة الخلع، ويتم تحديد مبلغ النفقة بناءً على الظروف المعيشية للمرأة والأطفال والزوج."
كنت عايز اعرف ايه اللي بيتم في دعوة اعتراض علي انذار طاعه بعد جلسة الخبراء واحالتها لجلسة التحقيق,"ويتضمن هذا الإجراء تقديم الوثائق والأدلة والشهادات التي تدعم موقف الشخص الذي يرفع الدعوى، كما يمكنه توجيه الأسئلة للجهة المعنية بالإنذار بالطاعة والمناط بها مسؤولية الموقف الذي أدى للإنذار."
استشاره قانونيه من الساده الافاضل . لو الزوجه اتحكملها بنفقع زوجيه متجمده ورفعة قضيه خلع وخلعة هل من حقها النفقه ولا بسقط بالخلع ارجو الافاده للاهميه وشكرا جدا لحضارتكم,"وينبغي للزوجة التقدم بطلب النفقة، وذلك بإثبات احتياجها لها، ويمكن أن تكون هناك آلية قانونية لتحديد حجم وطريقة دفع النفقة، وذلك حسب القانون المعمول به في بلدك."
السلام عليكم بنتي مطلقه من 6سنين طلقبهاطلب رؤيه بنته عن طريق فيديو الموبايل بنتي وافقت علشان الحرمان بعد اقناعها من اللي حواليها وبعت لها هدايا وعرفته عن طريق كاميره الفيديو المهم استمر لمده سنه وبعدين  حدث منه موقف البنت وشها اتغير  وهي أحيانا عايزاه اكلم بابا يعمل بحجه أن هو مش فاضي ومشغول المهم أن قطعت الحديث.  معه الأيام دي طلب ان يراهاوالا أرفع قضيه رؤيه بس بعد 6شهور لأنه مسافر المهم  قالوا إذا بنتي رفضت الرؤيه في إلا ل عندها في محاولاتهم بأسيوط وبعد كده إذا رفضت تروح بلده  كل كام أسبوع احنا خايفين من بعد المسافه وأن يتامروا وياخدوا البنت عايزين رأي القانون في هذا,"وبالنسبة لحالة بنتكم، فغالبًا ما يعتمد الحكم في قضايا الحضانة على مصلحة الطفل، ويجب التأكد من أن الأمور تتم في مصلحة الطفل، وبشكل يحقق له مستقبلًا جيدًا وصحيًا."
